<?xml version="1.0" encoding="UTF-8"?>
<!DOCTYPE advertisements SYSTEM "advertisements_ent.dtd" [
	<!ELEMENT garage (#PCDATA)>
	<!ENTITY % extra_house ",garage?">
]>
<advertisements>
	<studio>
		<address>Rue Saint-Paul 52 4000 Liège</address>
		<rooms>1</rooms>
		<bathrooms>1</bathrooms>
		<rent charges="included">250</rent>
	</studio>
	<apartment>
		<address>Rue de la Cathédrale 13 4000 Liège</address>
		<rooms>2</rooms>
		<bathrooms>1</bathrooms>
		<rent charges="not_included">500</rent>
	</apartment>
	<house>
		<address>Rhode-Saint-Genèse</address>
		<rooms>4</rooms>
		<bathrooms>2</bathrooms>
		<sale>750000</sale>
		<garden area="300"/>
	</house>
	<house>
		<address>Linkebeek</address>
		<rooms>3</rooms>
		<bathrooms>1</bathrooms>
		<sale>500000</sale>
		<garden area="100"/>
		<garage>2</garage>
	</house>
</advertisements>
